{
  "$schema": "https://json-schema.org/draft/2020-12/schema",
  "$id": "https://schemas.heimgewebe.org/contracts/knowledge.observatory.schema.json",
  "title": "KnowledgeObservatory",
  "x-producers": ["semantAH"],
  "x-consumers": ["leitstand"],
  "x-retired-consumers": ["hausKI", "heimlern"],
  "description": "Snapshot des semantischen Observatoriums.",
  "type": "object",
  "properties": {
    "observatory_id": {
      "type": "string",
      "description": "Stabile ID des Snapshots."
    },
    "generated_at": {
      "type": "string",
      "format": "date-time",
      "description": "Erzeugungszeitpunkt (ISO-8601)."
    },
    "source": {
      "type": "object",
      "description": "Erzeugende Komponente.",
      "properties": {
        "component": {
          "type": "string"
        },
        "version": {
          "type": "string"
        }
      },
      "required": ["component"],
      "additionalProperties": true
    },
    "topics": {
      "type": "array",
      "description": "Liste der Themenräume.",
      "items": {
        "type": "object",
        "properties": {
          "topic": {
            "type": "string",
            "description": "Bezeichnung des Themas."
          },
          "confidence": {
            "type": "number",
            "minimum": 0,
            "maximum": 1,
            "description": "Konfidenzwert (0-1)."
          },
          "sources": {
            "type": "array",
            "description": "Quellen, aus denen der Themenraum gespeist wird.",
            "items": {
              "type": "object",
              "properties": {
                "ref": { "type": "string" },
                "type": { "type": "string", "enum": ["event", "repo_file", "vault_note", "url", "other"] },
                "weight": { "type": "number", "minimum": 0, "maximum": 1 }
              },
              "required": ["ref", "type"],
              "additionalProperties": true
            }
          },
          "suggested_questions": {
            "type": "array",
            "description": "Offene Fragen, die aus diesem Themenraum hervorgehen.",
            "items": {
              "type": "string"
            }
          }
        },
        "required": ["topic", "confidence"],
        "additionalProperties": false
      }
    },
    "signals": {
      "type": "array",
      "description": "Liste von Signalen.",
      "items": {
        "type": "object",
        "description": "Einzelsignal.",
        "properties": {
          "type": { "type": "string", "description": "Typ des Signals (z. B. anomaly, trend)." },
          "description": { "type": "string", "description": "Textuelle Beschreibung." }
        },
        "required": ["type"],
        "additionalProperties": true
      }
    },
    "blind_spots": {
      "type": "array",
      "description": "Liste bekannter blinder Flecken.",
      "items": {
        "type": "string"
      }
    },
    "considered_but_rejected": {
      "type": "array",
      "description": "Liste verworfener Hypothesen oder Themen.",
      "items": {
        "oneOf": [
          { "type": "string" },
          { "type": "object", "additionalProperties": true }
        ]
      }
    }
  },
  "required": ["observatory_id", "generated_at", "source", "topics", "signals", "blind_spots", "considered_but_rejected"],
  "additionalProperties": false
}
